{
  "pilotEvidenceLedgerId": "pilotevidenceledger-001",
  "generatedAt": "2026-06-10T11:30:00Z",
  "ledgerMode": "checked_sanitized_pilot_summary_intake",
  "bindings": {
    "releaseManifestId": "releasemanifest-001",
    "agentPilotValidationId": "agentpilotvalidation-001",
    "developerAdoptionSurfaceId": "developeradoptionsurface-001",
    "pilotProtocolId": "agentpilotprotocol-001",
    "feedbackSchemaId": "agentpilotfeedback-001"
  },
  "intakePolicy": {
    "policyId": "pilotevidencepolicy-001",
    "minimumRealSessions": 3,
    "targetRealSessions": 5,
    "allowedInputs": [
      "Dimension scores tied to checked pilot task IDs.",
      "Sanitized findings that omit participant identity, private data, raw transcript text, and credentials.",
      "Friction classes and expansion signals chosen from the checked ledger vocabulary."
    ],
    "blockedInputs": [
      "Raw transcripts, recordings, prompt logs, or full chat excerpts.",
      "Private source rows, source credentials, customer names, internal table names, or unredacted identifiers.",
      "Any pilot note that turns fixture success into quality, calibration, hosted-runtime, or production-readiness claims."
    ],
    "requiredSanitizationChecks": [
      "Confirm no raw transcript or recording text is stored.",
      "Confirm no private rows, credentials, prompt logs, or participant identity are stored.",
      "Confirm findings are summarized enough for repository storage.",
      "Confirm claim-boundary confusion is recorded as a product signal, not a quality claim."
    ],
    "acceptedUse": "Accepted sanitized summaries may inform adoption fixes and expansion-readiness decisions, but not forecast quality, calibration, or production-runtime claims."
  },
  "caseRows": [
    {
      "caseId": "pilotevidencecase-001",
      "caseKey": "accepted_sanitized_summary",
      "evidenceClass": "synthetic_example",
      "participantProfile": "agent_developer",
      "taskRefs": [
        "agentpilottask-001",
        "agentpilottask-004",
        "agentpilottask-005"
      ],
      "intakeStatus": "accepted_for_aggregation",
      "acceptedForAggregation": true,
      "contributesRealSessionEvidence": false,
      "inputSignals": {
        "rawTranscriptSubmitted": false,
        "privateDataSubmitted": false,
        "credentialLikeTextSubmitted": false,
        "claimConfusionObserved": false,
        "runtimeGapObserved": false
      },
      "privacyChecks": {
        "rawTranscriptStored": false,
        "privateDataStored": false,
        "credentialsStored": false,
        "promptLogStored": false,
        "participantIdentityStored": false,
        "notesRedacted": true
      },
      "dimensionRatings": [
        {
          "dimensionId": "task_completion",
          "score": 5,
          "evidenceNote": "Completed local setup readback and forecast-run readback without moderator correction."
        },
        {
          "dimensionId": "forecast_card_comprehension",
          "score": 4,
          "evidenceNote": "Identified probability, baseline, resolution, scoring, and claim status."
        },
        {
          "dimensionId": "claim_boundary_comprehension",
          "score": 5,
          "evidenceNote": "Kept one scored fixture separate from calibration or broad quality claims."
        },
        {
          "dimensionId": "trust_for_agent_decision_support",
          "score": 4,
          "evidenceNote": "Would use the card for supervised agent support with claim warnings visible."
        }
      ],
      "sanitizedFindings": [
        "Participant reached forecast-1102 card and lifecycle bundle from the local MVP path.",
        "Participant understood that public transit calibration remains below threshold."
      ],
      "frictionClasses": [
        "none"
      ],
      "expansionSignals": [
        "keep_local_mvp",
        "run_more_pilots"
      ],
      "nextAction": "Count this shape as an acceptable sanitized-summary format for future real sessions."
    },
    {
      "caseId": "pilotevidencecase-002",
      "caseKey": "needs_redaction",
      "evidenceClass": "synthetic_example",
      "participantProfile": "supervising_developer",
      "taskRefs": [
        "agentpilottask-002"
      ],
      "intakeStatus": "needs_redaction",
      "acceptedForAggregation": false,
      "contributesRealSessionEvidence": false,
      "inputSignals": {
        "rawTranscriptSubmitted": false,
        "privateDataSubmitted": false,
        "credentialLikeTextSubmitted": false,
        "claimConfusionObserved": false,
        "runtimeGapObserved": true
      },
      "privacyChecks": {
        "rawTranscriptStored": false,
        "privateDataStored": false,
        "credentialsStored": false,
        "promptLogStored": false,
        "participantIdentityStored": false,
        "notesRedacted": false
      },
      "dimensionRatings": [
        {
          "dimensionId": "source_intake_comprehension",
          "score": 3,
          "evidenceNote": "Understood accepted adapter output but included too much implementation-specific context in notes."
        },
        {
          "dimensionId": "runtime_gap_classification",
          "score": 4,
          "evidenceNote": "Correctly identified a missing runtime feature rather than a failed forecast."
        }
      ],
      "sanitizedFindings": [
        "Summary is structurally useful but needs further redaction before aggregation.",
        "Runtime gap should be classified without copying private source names or table details."
      ],
      "frictionClasses": [
        "privacy_redaction_needed",
        "source_runtime_gap"
      ],
      "expansionSignals": [
        "consider_next_source_runtime",
        "run_more_pilots"
      ],
      "nextAction": "Redact source-specific details, then reclassify as accepted or blocked."
    },
    {
      "caseId": "pilotevidencecase-003",
      "caseKey": "raw_transcript_blocked",
      "evidenceClass": "synthetic_example",
      "participantProfile": "agent_developer",
      "taskRefs": [
        "agentpilottask-001"
      ],
      "intakeStatus": "blocked_raw_transcript",
      "acceptedForAggregation": false,
      "contributesRealSessionEvidence": false,
      "inputSignals": {
        "rawTranscriptSubmitted": true,
        "privateDataSubmitted": false,
        "credentialLikeTextSubmitted": false,
        "claimConfusionObserved": false,
        "runtimeGapObserved": false
      },
      "privacyChecks": {
        "rawTranscriptStored": false,
        "privateDataStored": false,
        "credentialsStored": false,
        "promptLogStored": false,
        "participantIdentityStored": false,
        "notesRedacted": false
      },
      "dimensionRatings": [],
      "sanitizedFindings": [
        "Raw transcript input must be rejected before it enters the checked ledger.",
        "Only summarized dimension scores and sanitized findings are allowed."
      ],
      "frictionClasses": [
        "privacy_redaction_needed"
      ],
      "expansionSignals": [
        "run_more_pilots"
      ],
      "nextAction": "Replace raw transcript with a sanitized summary that follows the intake policy."
    },
    {
      "caseId": "pilotevidencecase-004",
      "caseKey": "private_data_blocked",
      "evidenceClass": "synthetic_example",
      "participantProfile": "supervising_developer",
      "taskRefs": [
        "agentpilottask-003"
      ],
      "intakeStatus": "blocked_private_data",
      "acceptedForAggregation": false,
      "contributesRealSessionEvidence": false,
      "inputSignals": {
        "rawTranscriptSubmitted": false,
        "privateDataSubmitted": true,
        "credentialLikeTextSubmitted": true,
        "claimConfusionObserved": false,
        "runtimeGapObserved": false
      },
      "privacyChecks": {
        "rawTranscriptStored": false,
        "privateDataStored": false,
        "credentialsStored": false,
        "promptLogStored": false,
        "participantIdentityStored": false,
        "notesRedacted": false
      },
      "dimensionRatings": [],
      "sanitizedFindings": [
        "Private rows or credential-like details must not be stored in pilot evidence.",
        "Unsafe source notes should be reduced to blocked reason, next action, and dimension scores."
      ],
      "frictionClasses": [
        "privacy_redaction_needed"
      ],
      "expansionSignals": [
        "improve_docs"
      ],
      "nextAction": "Discard private details and record only sanitized blocked-path comprehension findings."
    },
    {
      "caseId": "pilotevidencecase-005",
      "caseKey": "claim_boundary_confusion",
      "evidenceClass": "synthetic_example",
      "participantProfile": "agent_developer",
      "taskRefs": [
        "agentpilottask-005"
      ],
      "intakeStatus": "accepted_with_claim_boundary_issue",
      "acceptedForAggregation": true,
      "contributesRealSessionEvidence": false,
      "inputSignals": {
        "rawTranscriptSubmitted": false,
        "privateDataSubmitted": false,
        "credentialLikeTextSubmitted": false,
        "claimConfusionObserved": true,
        "runtimeGapObserved": false
      },
      "privacyChecks": {
        "rawTranscriptStored": false,
        "privateDataStored": false,
        "credentialsStored": false,
        "promptLogStored": false,
        "participantIdentityStored": false,
        "notesRedacted": true
      },
      "dimensionRatings": [
        {
          "dimensionId": "task_completion",
          "score": 4,
          "evidenceNote": "Completed the claim-gate readback."
        },
        {
          "dimensionId": "claim_boundary_comprehension",
          "score": 2,
          "evidenceNote": "Initially treated one scored transit run as a quality claim."
        },
        {
          "dimensionId": "trust_for_agent_decision_support",
          "score": 3,